{
  "$schema": "../../catalog/schemas/ui-requirement.schema.json",
  "schemaVersion": 1,
  "id": "atomic.fixture.account.master-detail.ui-only",
  "recipe": "master-detail",
  "feature": {
    "key": "account-summary",
    "className": "AccountSummary",
    "selector": "prest-account-summary-page",
    "title": "Resumen de cuentas",
    "singular": "cuenta",
    "plural": "cuentas"
  },
  "model": {
    "name": "AccountSummary",
    "id": {
      "name": "accountId",
      "type": "string"
    },
    "fields": [
      {
        "name": "customerName",
        "type": "string",
        "label": "Cliente",
        "required": true
      },
      {
        "name": "balance",
        "type": "number",
        "label": "Saldo",
        "initialValue": 0,
        "minimum": 0,
        "maximum": 999999999,
        "step": 0.01
      },
      {
        "name": "active",
        "type": "boolean",
        "label": "Estado",
        "initialValue": true
      }
    ]
  },
  "table": {
    "pageSize": 10,
    "columns": [
      {
        "field": "customerName",
        "header": "Cliente",
        "sortable": true
      },
      {
        "field": "balance",
        "header": "Saldo",
        "sortable": true
      },
      {
        "field": "active",
        "header": "Estado"
      }
    ]
  },
  "detail": {
    "fields": ["customerName", "balance", "active"]
  },
  "variants": {
    "density": "compact",
    "detailPlacement": "aside",
    "actionDisplay": "inline"
  },
  "contract": {
    "mode": "ui-only",
    "capabilities": ["list", "read"]
  }
}
